{
  "schema_version": "openclaw.main.routing-decision.v1alpha1",
  "routing_decision_id": "route:intake:hcr-20260323-intake-broker-submission-candidate",
  "routing_mode": "repo_side_dry_run",
  "intake_id": "intake:hcr-20260323-intake-broker-submission-candidate",
  "task_id": "task-intake-broker-submission-candidate",
  "run_id": "run-20260323-intake-broker-submission-candidate",
  "source_request_id": "hcr-20260323-intake-broker-submission-candidate",
  "decision": "BROKER_SUBMISSION_CANDIDATE",
  "submission_target": "broker_submission_envelope",
  "intake_status": "accepted",
  "dispatch_scope": "readonly",
  "dispatch_status": "broker_ready",
  "requires_operator_approval": false,
  "source_artifacts": {
    "normalized_request_path": "fixtures/main-routing/valid-broker-submission-candidate/request.normalized.json",
    "intake_report_path": "fixtures/main-routing/valid-broker-submission-candidate/intake-report.json"
  },
  "summary_context": {
    "goal": "Prepare a repo-side broker submission candidate dry-run artifact.",
    "outcome": "The runner produced a readonly request that should advance to a dry-run broker submission envelope and stop there.",
    "request_title": "Assemble a broker submission candidate dry-run",
    "request_scope": "Readonly validation and candidate assembly only, with no broker call and no runtime mutation."
  },
  "validation_status": {
    "normalized_request": "passed",
    "intake_report": "passed",
    "cross_document": "passed"
  },
  "broker_request_count": 2,
  "refusal_reasons": [],
  "forbidden_actions": [
    "direct_docker_control",
    "direct_host_shell",
    "direct_openclaw_config_edit",
    "direct_secret_handling",
    "direct_snapshot_manipulation",
    "direct_systemd_control",
    "direct_vault_manipulation",
    "unstructured_operator_commands",
    "user_level_gateway_start"
  ],
  "boundary_carry_forward": {
    "repo_side_only": true,
    "live_side_publish_performed": false,
    "broker_dispatch_performed": false,
    "openclaw_runtime_modified": false,
    "operator_command_blocks_present": false
  },
  "evidence_refs": [
    {
      "id": "design-v3",
      "kind": "design_doc",
      "path": "docs/design-v3.md",
      "description": "Design anchor for routing to a broker submission candidate."
    },
    {
      "id": "current-boundary",
      "kind": "boundary_doc",
      "path": "docs/current-boundary.md",
      "description": "Confirms the candidate remains repo-side and dry-run only."
    },
    {
      "id": "artifact-contract",
      "kind": "repo_file",
      "path": "workspace-task-runner-template/control/artifact-contract.md",
      "description": "Artifact contract requiring declarative host-change intent."
    }
  ],
  "reasoning": "Main preserves the accepted readonly request as a dry-run broker submission candidate without dispatching it."
}
