{
  "schema_version": "openclaw.main.routing-decision.v1alpha1",
  "routing_decision_id": "route:intake:hcr-20260322-intake-host-affecting",
  "routing_mode": "repo_side_dry_run",
  "intake_id": "intake:hcr-20260322-intake-host-affecting",
  "task_id": "task-intake-host-affecting",
  "run_id": "run-20260322-intake-host-affecting",
  "source_request_id": "hcr-20260322-intake-host-affecting",
  "decision": "REQUIRES_OPERATOR_APPROVAL",
  "submission_target": "operator_approval_envelope",
  "intake_status": "accepted",
  "dispatch_scope": "host_affecting",
  "dispatch_status": "operator_approval_required",
  "requires_operator_approval": true,
  "source_artifacts": {
    "normalized_request_path": "fixtures/main-routing/valid-host-affecting/request.normalized.json",
    "intake_report_path": "fixtures/main-routing/valid-host-affecting/intake-report.json"
  },
  "summary_context": {
    "goal": "Prepare a host-affecting intake path that stays dry-run and broker-ready only.",
    "outcome": "The runner produced a host-affecting request that still stops at main-side normalization and approval gating.",
    "request_title": "Assemble a host-affecting broker-ready request dry-run",
    "request_scope": "Static dry-run only: validate, normalize, and shape future broker requests without any live dispatch."
  },
  "validation_status": {
    "normalized_request": "passed",
    "intake_report": "passed",
    "cross_document": "passed"
  },
  "broker_request_count": 6,
  "refusal_reasons": [],
  "forbidden_actions": [
    "direct_docker_control",
    "direct_host_shell",
    "direct_openclaw_config_edit",
    "direct_secret_handling",
    "direct_snapshot_manipulation",
    "direct_systemd_control",
    "direct_vault_manipulation",
    "unstructured_operator_commands",
    "user_level_gateway_start"
  ],
  "boundary_carry_forward": {
    "repo_side_only": true,
    "live_side_publish_performed": false,
    "broker_dispatch_performed": false,
    "openclaw_runtime_modified": false,
    "operator_command_blocks_present": false
  },
  "evidence_refs": [
    {
      "id": "design-v3",
      "kind": "design_doc",
      "path": "docs/design-v3.md",
      "description": "Design anchor for main-side intake and broker-ready dry-runs."
    },
    {
      "id": "current-boundary",
      "kind": "boundary_doc",
      "path": "docs/current-boundary.md",
      "description": "Boundary freeze proving this slice remains repo-side and no-live-side."
    },
    {
      "id": "host-sop",
      "kind": "sop_doc",
      "path": "docs/host-sop.md",
      "description": "Host safety and snapshot discipline authority."
    },
    {
      "id": "summary-json",
      "kind": "output_file",
      "path": "outputs/summary.json",
      "description": "Structured summary that accompanies this host-affecting request."
    }
  ],
  "reasoning": "Main preserves operator approval for an accepted host-affecting request and emits only a dry-run approval envelope."
}
